user,bot
"I'm feeling really down lately, is there a difference between just being sad and being depressed?","Yes, there is a difference. Sadness is a normal emotion that everyone experiences from time to time. It's usually a reaction to a difficult situation and passes with time.  Depression, on the other hand, is a medical condition that interferes with daily life and functioning. It can cause a wide range of symptoms, including physical ones, and often requires treatment to get better."
What are some of the signs and symptoms of depression?,"Some common signs and symptoms include: persistent sad, anxious, or empty mood, feelings of hopelessness or pessimism, feelings of guilt, worthlessness, or helplessness, loss of interest in hobbies and activities, decreased energy, fatigue, difficulty concentrating, remembering, or making decisions, difficulty sleeping, appetite or weight changes, thoughts of death or suicide, restlessness or irritability"
"I've heard there are different types of depression, is that true?","Yes, there are several types of depressive disorders. Major depression involves severe symptoms that interfere with daily life. Persistent depressive disorder is a depressed mood that lasts for at least 2 years. Other types include psychotic depression, postpartum depression, and seasonal affective disorder (SAD)."
My friend is going through a tough time and seems really down. I'm worried about him. What can I do?,"The most important thing is to encourage your friend to seek professional help. You can offer your support by listening, being understanding, and reminding him that depression is treatable. You can also help him find a doctor or mental health professional and offer to go with him to appointments."
Is depression more common in certain groups of people?,"Depression can affect anyone, but it is more common in women than men. Biological, hormonal, and psychosocial factors unique to women are believed to contribute to this higher rate."
"I'm a man, and I've been feeling irritable and tired lately. Could this be a sign of depression?","Yes, irritability and fatigue can be symptoms of depression in men. Men may also experience other symptoms such as anger, loss of interest in hobbies, and difficulty sleeping. It's important to remember that depression can manifest differently in men and women."
My son has been complaining about stomach aches and refusing to go to school. Could this be depression?,"Depression in children can sometimes manifest as physical complaints like stomach aches or refusal to go to school. It's important to talk to your child and if you suspect depression, consult with their pediatrician or a mental health professional."
"Is it normal for teens to have mood swings, or could it be depression?","Occasional bad moods are a normal part of being a teen. However, if the mood swings are persistent, severe, and accompanied by other symptoms like irritability, negativity, or changes in sleep or appetite, it could be a sign of depression."
My grandmother seems more tired and grumpy lately. Could this be a sign of depression in older adults?,"Yes, depression in older adults can sometimes manifest as tiredness, difficulty sleeping, or irritability. It's important to remember that depression is not a normal part of aging and should not be dismissed."
I'm worried that my constant worrying might lead to depression. Is there a connection between anxiety and depression?,"Yes, there is a strong connection between anxiety and depression. High levels of anxiety, especially in children, can increase the risk of developing depression later in life."
I've been diagnosed with depression. What kind of treatment options are available?,"Depression is treatable. The most common treatments are medication, psychotherapy (talk therapy), or a combination of both. Your doctor can help you determine the best course of treatment for you."
What are antidepressants and how do they work?,"Antidepressants are medications that can help improve the way your brain uses certain chemicals that control mood and stress. There are different types of antidepressants, and it may take some trial and error to find the right one for you."
I'm hesitant to take medication. Are there other ways to treat depression?,"Yes, psychotherapy, also known as talk therapy, can be an effective treatment for depression, especially for mild to moderate cases.  There are different types of therapy, such as cognitive-behavioral therapy and interpersonal therapy."
I've heard about computer-based therapies. Are they effective?,"Some research suggests that internet-based therapies can be as effective as face-to-face therapy for some people. However, it's important to choose a reputable program and discuss it with your doctor or mental health provider."
Are there any apps that can help with depression?,"Yes, there are many mobile apps that claim to help with depression. However, it's important to remember that apps should not replace seeing your doctor. Look for apps that provide reliable, science-based information and consult with your doctor before making any changes to your treatment."
What is electroconvulsive therapy (ECT)?,Electroconvulsive therapy (ECT) is a treatment option for severe depression that has not responded to other treatments. It involves applying electrical impulses to the brain while the patient is under anesthesia.
I'm starting to feel better. What are some things I can do to help myself during treatment?,"There are many things you can do to support your treatment, such as trying to be active and exercise, setting realistic goals, breaking up large tasks into smaller ones, spending time with loved ones, and reminding yourself that improvement takes time."
My partner is struggling with depression. How can I best support them?," The most important thing is to offer your emotional support, understanding, patience, and encouragement.  Listen to them, never dismiss their feelings, and encourage them to seek professional help."
Where can I find more information and support for depression?,"You can find more information and support from organizations like the National Institute of Mental Health (NIMH), the Substance Abuse and Mental Health Services Administration (SAMHSA), and the National Alliance on Mental Illness (NAMI)."
I'm worried about the stigma surrounding mental illness. What can I do to help?,"You can help by talking openly about mental health, sharing accurate information, and challenging negative stereotypes.  Educating yourself and others is key to breaking down stigma."